{
  "as_of": "2026-08-23",
  "broken_relationships": [],
  "duplicate_aliases": [],
  "duplicate_names": [
    "api security",
    "digital forensics",
    "dns",
    "encryption",
    "http",
    "input validation",
    "least privilege",
    "malware analysis",
    "secure sdlc",
    "threat hunting",
    "tls",
    "vulnerability management",
    "zero trust"
  ],
  "missing_descriptions": [],
  "missing_relationships": [
    "concept:arp",
    "concept:dhcp",
    "defensive-control:backup",
    "defensive-control:csp",
    "defensive-control:dependency-management",
    "defensive-control:endpoint-hardening",
    "defensive-control:network-monitoring",
    "defensive-control:patch-management",
    "defensive-control:siem",
    "defensive-control:zero-trust",
    "lab:authentication-session-review",
    "lab:authorization-matrix-testing",
    "lab:cloud-least-privilege-review",
    "lab:container-sbom-and-scan",
    "lab:detection-rule-engineering",
    "lab:evidence-first-analysis",
    "lab:memory-analysis-fundamentals",
    "lab:sql-injection-concepts",
    "lab:static-malware-triage",
    "learning-path:api-security",
    "learning-path:beginner",
    "learning-path:blue-team",
    "learning-path:bug-bounty",
    "learning-path:cloud-security",
    "learning-path:devsecops",
    "learning-path:ethical-hacking",
    "learning-path:malware-analysis",
    "learning-path:network-security",
    "learning-path:penetration-testing",
    "learning-path:security-engineering",
    "learning-path:soc-analyst",
    "learning-path:threat-hunting",
    "learning-path:web-security",
    "technology:ansible",
    "technology:dotnet",
    "technology:elasticsearch",
    "technology:grpc",
    "technology:ios",
    "technology:kafka",
    "technology:powershell",
    "technology:redis",
    "technology:sbom",
    "technology:terraform"
  ],
  "missing_sources": [
    "lab:authentication-session-review",
    "lab:authorization-matrix-testing",
    "lab:cloud-least-privilege-review",
    "lab:container-sbom-and-scan",
    "lab:detection-rule-engineering",
    "lab:evidence-first-analysis",
    "lab:http-request-analysis",
    "lab:localhost-service-inventory",
    "lab:memory-analysis-fundamentals",
    "lab:packet-capture-fundamentals",
    "lab:sql-injection-concepts",
    "lab:static-malware-triage",
    "learning-path:api-security",
    "learning-path:beginner",
    "learning-path:blue-team",
    "learning-path:bug-bounty",
    "learning-path:cloud-security",
    "learning-path:devsecops",
    "learning-path:digital-forensics",
    "learning-path:ethical-hacking",
    "learning-path:malware-analysis",
    "learning-path:network-security",
    "learning-path:penetration-testing",
    "learning-path:security-engineering",
    "learning-path:soc-analyst",
    "learning-path:threat-hunting",
    "learning-path:web-security",
    "vulnerability:api-security",
    "vulnerability:authentication-weaknesses",
    "vulnerability:broken-access-control",
    "vulnerability:cloud-misconfiguration",
    "vulnerability:command-injection",
    "vulnerability:container-security",
    "vulnerability:cross-site-scripting",
    "vulnerability:cryptographic-failures",
    "vulnerability:csrf",
    "vulnerability:idor",
    "vulnerability:insecure-deserialization",
    "vulnerability:insecure-file-upload",
    "vulnerability:path-traversal",
    "vulnerability:security-misconfiguration",
    "vulnerability:sensitive-data-exposure",
    "vulnerability:session-management",
    "vulnerability:sql-injection",
    "vulnerability:ssrf",
    "vulnerability:supply-chain-vulnerabilities",
    "vulnerability:xxe"
  ],
  "orphaned_entities": [
    "concept:arp",
    "concept:dhcp",
    "defensive-control:backup",
    "defensive-control:csp",
    "defensive-control:dependency-management",
    "defensive-control:endpoint-hardening",
    "defensive-control:network-monitoring",
    "defensive-control:patch-management",
    "defensive-control:siem",
    "defensive-control:zero-trust",
    "lab:authentication-session-review",
    "lab:authorization-matrix-testing",
    "lab:cloud-least-privilege-review",
    "lab:container-sbom-and-scan",
    "lab:detection-rule-engineering",
    "lab:evidence-first-analysis",
    "lab:memory-analysis-fundamentals",
    "lab:sql-injection-concepts",
    "lab:static-malware-triage",
    "learning-path:api-security",
    "learning-path:beginner",
    "learning-path:blue-team",
    "learning-path:bug-bounty",
    "learning-path:cloud-security",
    "learning-path:devsecops",
    "learning-path:ethical-hacking",
    "learning-path:malware-analysis",
    "learning-path:network-security",
    "learning-path:penetration-testing",
    "learning-path:security-engineering",
    "learning-path:soc-analyst",
    "learning-path:threat-hunting",
    "learning-path:web-security",
    "technology:ansible",
    "technology:dotnet",
    "technology:elasticsearch",
    "technology:grpc",
    "technology:ios",
    "technology:kafka",
    "technology:powershell",
    "technology:redis",
    "technology:sbom",
    "technology:terraform"
  ],
  "overall_score": 81.05,
  "schema_version": "1.0",
  "scores": {
    "documentation": 100.0,
    "link_integrity": 100.0,
    "metadata": 100.0,
    "relationships": 85.99,
    "sources": 84.69,
    "verification": 15.64
  },
  "stale_after_days": 180,
  "stale_verification": [],
  "status_counts": {
    "deprecated": 0,
    "needs-review": 217,
    "partially-verified": 48,
    "unverified": 42,
    "verified": 0
  },
  "total_entities": 307
}
